{
  "$schema": "https://json-schema.org/draft/2020-12/schema",
  "$id": "https://rome-protocol.github.io/registry/schema/programs.schema.json",
  "title": "Solana program IDs (per-network)",
  "description": "Canonical program IDs for the protocols Rome integrates with on a given Solana cluster. Required entries are core SPL / system programs that exist identically across networks; everything else is optional and only present when (a) Rome's services or Cardo's adapters use it, and (b) it's deployed on that cluster.",
  "type": "object",
  "required": ["splToken", "associatedToken", "systemProgram"],
  "additionalProperties": false,
  "properties": {
    "splToken":               { "type": "string", "description": "SPL Token program (classic Tokenkeg)." },
    "splToken2022":           { "type": "string", "description": "SPL Token-2022 (extensions: transfer hooks, confidential transfers, etc.)." },
    "associatedToken":        { "type": "string" },
    "systemProgram":          { "type": "string" },
    "memo":                   { "type": "string", "description": "SPL Memo program — used by Cardo to tag orchestrator txs." },

    "wormholeCore":           { "type": "string" },
    "wormholeTokenBridge":    { "type": "string" },
    "cctpMessageTransmitter": { "type": "string" },
    "cctpTokenMessenger":     { "type": "string" },

    "stakePool":              { "type": "string", "description": "SPL stake-pool program — covers JitoSOL, bSOL, JupSOL, dSOL, etc. Marinade is separate." },
    "marinade":               { "type": "string", "description": "Marinade Liquid Staking — its own program (NOT spl-stake-pool). mSOL deposit/unstake target." },

    "raydiumAmmV4":           { "type": "string", "description": "Raydium hand-rolled AMM v4 — devnet redeploy at HWy1jot…, NOT same as mainnet." },
    "raydiumCpmm":            { "type": "string", "description": "Raydium constant-product MM — Anchor-based; devnet redeploy at CPMDWBwJ…." },
    "raydiumClmm":            { "type": "string", "description": "Raydium concentrated-liquidity MM — devnet redeploy at devi51m…." },
    "meteoraDlmm":            { "type": "string", "description": "Meteora Dynamic Liquidity MM (LB-pair / multi-bin)." },
    "meteoraDammV1":          { "type": "string", "description": "Meteora dynamic AMM v1 — production gas-pricing pool family." },
    "meteoraDammV2":          { "type": "string", "description": "Meteora dynamic AMM v2." },
    "orcaWhirlpool":          { "type": "string" },
    "phoenix":                { "type": "string", "description": "Phoenix CLOB — order-book DEX." },
    "pumpFun":                { "type": "string", "description": "Pump.fun bonding-curve token launches." },
    "pumpSwap":               { "type": "string", "description": "PumpSwap — DEX layer over Pump.fun graduations." },

    "kaminoLend":             { "type": "string", "description": "Kamino lending (klend) — Main market USDC reserve. Mainnet only today." },
    "kaminoFarms":            { "type": "string", "description": "Kamino farms — required for klend deposits with farms enabled." },
    "mangoV4":                { "type": "string", "description": "Mango v4 — perpetuals + spot + lending." },
    "driftV2":                { "type": "string", "description": "Drift v2 — perpetuals + spot." },
    "marginfiV2":             { "type": "string", "description": "MarginFi v2 — lending." },
    "streamflow":             { "type": "string", "description": "Streamflow — token vesting + payment streaming." },
    "sns":                    { "type": "string", "description": "Solana Name Service — domain registration." },
    "squadsV4":               { "type": "string", "description": "Squads V4 multisig — propose / approve / execute." },
    "splGovernance":          { "type": "string", "description": "SPL Governance (Realms) — DAO voting." },
    "jupiterV6":              { "type": "string", "description": "Jupiter aggregator router (v6) — used by Cardo orchestrator for swap + stake routing." }
  }
}
