{
  "splToken":               "TokenkegQfeZyiNwAJbNbGKPFXCWuBvf9Ss623VQ5DA",
  "splToken2022":           "TokenzQdBNbLqP5VEhdkAS6EPFLC1PHnBqCXEpPxuEb",
  "associatedToken":        "ATokenGPvbdGVxr1b2hvZbsiqW5xWH25efTNsLJA8knL",
  "systemProgram":          "11111111111111111111111111111111",
  "memo":                   "MemoSq4gqABAXKb96qnH8TysNcWxMyWCqXgDLGmfcHr",

  "wormholeCore":           "3u8hJUVTA4jH1wYAyUur7FFZVQ8H635K3tSHHF4ssjQ5",
  "wormholeTokenBridge":    "DZnkkTmCiFWfYTfT41X3Rd1kDgozqzxWaHqsw6W4x2oe",
  "cctpMessageTransmitter": "CCTPmbSD7gX1bxKPAmg77w8oFzNFpaQiQUWD43TKaecd",
  "cctpTokenMessenger":     "CCTPiPYPc6AsJuwueEnWgSgucamXDZwBd53dQ11YiKX3",

  "stakePool":              "SPoo1Ku8WFXoNDMHPsrGSTSG1Y47rzgn41SLUNakuHy",
  "marinade":               "MarBmsSgKXdrN1egZf5sqe1TMai9K1rChYNDJgjq7aD",

  "raydiumAmmV4":           "HWy1jotHpo6UqeQxx49dpYYdQB8wj9Qk9MdxwjLvDHB8",
  "raydiumCpmm":            "CPMDWBwJDtYax9qW7AyRuVC19Cc4L4Vcy4n2BHAbHkCW",
  "raydiumClmm":            "devi51mZmdwUJGU9hjN27vEz64Gps7uUefqxg27EAtH",
  "meteoraDlmm":            "LBUZKhRxPF3XUpBCjp4YzTKgLccjZhTSDM9YuVaPwxo",
  "orcaWhirlpool":          "whirLbMiicVdio4qvUfM5KAg6Ct8VwpYzGff3uctyCc",
  "phoenix":                "PhoeNiXZ8ByJGLkxNfZRnkUfjvmuYqLR89jjFHGqdXY",
  "pumpFun":                "6EF8rrecthR5Dkzon8Nwu78hRvfCKubJ14M5uBEwF6P",
  "pumpSwap":               "pAMMBay6oceH9fJKBRHGP5D4bD4sWpmSwMn52FMfXEA",

  "mangoV4":                "4MangoMjqJ2firMokCjjGgoK8d4MXcrgL7XJaL3w6fVg",
  "driftV2":                "dRiftyHA39MWEi3m9aunc5MzRF1JYuBsbn6VPcn33UH",
  "streamflow":             "HqDGZjaVRXJ9MGRQEw7qDc2rAr6iH1n1kAQdCZaCMfMZ",
  "sns":                    "namesLPneVptA9Z5rqUDD9tMTWEJwofgaYwp8cawRkX",
  "squadsV4":               "SQDS4ep65T869zMMBKyuUq6aD6EgTu8psMjkvj52pCf",
  "splGovernance":          "GovER5Lthms3bLBqWub97yVrMmEogzX7xNjdXpPPCVZw",
  "jupiterV6":              "JUP6LkbZbjS1jKKwapdHNy74zcZ3tLUZoi5QNyVTaV4"
}
